{
  "slug": "lab-anh-huong-nong-do-toc-do",
  "output_file": "skills_material_K12/skills/chemistry-experiment-lab/outputs/lab-anh-huong-nong-do-toc-do.html",
  "prompt": "Regenerate from scratch with the updated chemistry-experiment-lab skill; old HTML should be ignored.",
  "experiment": {
    "title": "Ảnh hưởng của nồng độ đến tốc độ phản ứng",
    "grade": "Hóa 10",
    "learning_goal": "So sánh tốc độ tạo độ đục sulfur ở ba nồng độ và rút ra mối liên hệ với tốc độ phản ứng.",
    "learning_loop": {
      "predict": "Dự đoán cốc nào làm dấu X biến mất nhanh nhất.",
      "observe": "Quan sát độ đục sulfur và tốc độ che dấu X trong ba cốc.",
      "compare": "So sánh tiến độ giữa cốc A, B và C như một cuộc đua.",
      "explain": "Nồng độ cao hơn làm số va chạm hiệu quả nhiều hơn nên hiện tượng xảy ra nhanh hơn."
    },
    "reaction": "Na2S2O3 + H2SO4 -> Na2SO4 + SO2 + S + H2O",
    "notes": "Three-beaker race with autoplay timeline; sulfur turbidity is the main observable proxy."
  },
  "interaction_pattern": "variable-comparison-lab",
  "libraries": [
    {
      "name": "Three.js",
      "version": "r128 / 0.137.0 fallback",
      "role": "render",
      "rationale": "observable chemistry: ba cốc 3D, độ đục, hạt sulfur và dấu X là trọng tâm",
      "cdn_urls": [
        "https://cdnjs.cloudflare.com/ajax/libs/three.js/r128/three.min.js",
        "https://unpkg.com/three@0.137.0/build/three.min.js"
      ]
    },
    {
      "name": "GSAP",
      "version": "3.12.5",
      "role": "timeline",
      "rationale": "timeline: race tự chạy, pause/resume/reset và đồng bộ ba cốc",
      "cdn_urls": [
        "https://cdnjs.cloudflare.com/ajax/libs/gsap/3.12.5/gsap.min.js",
        "https://cdn.jsdelivr.net/npm/gsap@3.12.5/dist/gsap.min.js"
      ]
    }
  ],
  "model_fidelity": "semi-quantitative",
  "validation_results": {
    "js_syntax": "pass: inline script extracted and checked with node --check",
    "risky_globals": "pass: no matches for GK/gkStart/gkLoadThree/unscoped document.querySelector/latest/next in outputs",
    "cdn_version_pin": "pass: all library URLs are version pinned",
    "fallbacks": "pass: load failures are routed to visible fallback messages",
    "autoplay_or_demo": "pass: autoplay race timeline plus pause/reset controls",
    "layout": "pass: three-beaker stage dominates first viewport; race panel is compact",
    "browser_smoke": "pass: verify-widget.sh produced desktop/mobile screenshots and trace artifacts",
    "mobile_check": "pass: mobile screenshot shows no horizontal overflow and all primary controls remain visible"
  },
  "scores": {
    "chemistry_pedagogy": 18,
    "visual_dynamism": 15,
    "interaction_autoplay": 15,
    "lab_first_layout": 14,
    "technical_html": 15,
    "performance_mobile": 8,
    "learning_record": 10,
    "total": 95
  },
  "blockers": [],
  "warnings": [],
  "chemistry_review": "The output clearly frames sulfur turbidity as the observable proxy and avoids implying a complete quantitative rate law.",
  "browser_checks": "Playwright-based verifier passed on desktop and mobile. WebGL ran through SwiftShader fallback in headless Chromium.",
  "mobile_checks": "Mobile verification passed with no overflow and retained visibility of the race controls.",
  "design_family": "kinetics-comparison",
  "design_fingerprint": "three-gsap-race-stage-first-predict-observe-explain",
  "promoted_as_baseline": false,
  "verification": {
    "environment": {
      "browser": "chromium",
      "headless": true,
      "os": "linux",
      "viewport": "desktop-1280x800 + mobile-iPhone13"
    },
    "webgl": {
      "supported": true,
      "renderer_type": "ANGLE (Google, Vulkan 1.3.0 (SwiftShader Device (Subzero) (0x0000C0DE)), SwiftShader driver)",
      "fallback_used": true
    },
    "invariants": {
      "stage_present": true,
      "stage_dominance_pass": true,
      "autoplay_or_primary_run_pass": true,
      "mobile_fit_pass": true,
      "fallback_present": false
    }
  },
  "artifacts": {
    "desktop_screenshot": "/home/ding/debug_mc/material_creator/skills_material_K12/skills/chemistry-experiment-lab/evaluations/artifacts/lab-anh-huong-nong-do-toc-do/2026-06-19T19-16-07Z/desktop.png",
    "mobile_screenshot": "/home/ding/debug_mc/material_creator/skills_material_K12/skills/chemistry-experiment-lab/evaluations/artifacts/lab-anh-huong-nong-do-toc-do/2026-06-19T19-16-07Z/mobile.png",
    "trace": "/home/ding/debug_mc/material_creator/skills_material_K12/skills/chemistry-experiment-lab/evaluations/artifacts/lab-anh-huong-nong-do-toc-do/2026-06-19T19-16-07Z"
  },
  "improvement_plan": [
    "Add a lightweight direct state probe if future kinetics widgets rely more on canvas-only animation than text/state change.",
    "Promote to baseline only after checking on a real GPU browser in addition to headless SwiftShader."
  ],
  "changes_applied": [
    "Regenerated output from scratch using updated skill rules.",
    "Added full HTML wrapper with UTF-8 metadata.",
    "Verified with the new Playwright-based verifier script."
  ],
  "final_status": "pass",
  "created_at": "2026-06-19T19:16:07Z",
  "tool_model": "gpt-5 codex"
}
