{
  "slug": "lab-anh-huong-nong-do-toc-do",
  "output_file": "skills_material_K12/skills/chemistry-experiment-lab/outputs/lab-anh-huong-nong-do-toc-do.html",
  "prompt": "GEN LẠI và ghi đè HTML output hiện có bằng skill chemistry-experiment-lab phiên bản mới; chủ đề ảnh hưởng của nồng độ đến tốc độ phản ứng Na2S2O3 + H2SO4.",
  "experiment": {
    "title": "Ảnh hưởng của nồng độ đến tốc độ phản ứng",
    "grade": "Hóa 10",
    "learning_goal": "Liên hệ nồng độ Na2S2O3 với tốc độ tạo lưu huỳnh keo làm đục dung dịch và che dấu X.",
    "reaction": "Na2S2O3 + H2SO4 -> Na2SO4 + SO2 + S + H2O",
    "notes": "Độ đục và phần trăm thấy dấu X là proxy bán định lượng, không phải dữ liệu động học thật."
  },
  "interaction_pattern": "kinetics-time-slider",
  "libraries": [
    {
      "name": "Three.js",
      "version": "r128 / 0.137.0 fallback",
      "role": "Scene 3D cốc phản ứng, dung dịch, dấu X, hạt lưu huỳnh và bọt SO2 minh họa.",
      "cdn_urls": [
        "https://cdnjs.cloudflare.com/ajax/libs/three.js/r128/three.min.js",
        "https://unpkg.com/three@0.137.0/build/three.min.js"
      ]
    },
    {
      "name": "Chart.js",
      "version": "4.4.3",
      "role": "Đồ thị độ đục tương đối theo thời gian; có canvas fallback nếu CDN lỗi.",
      "cdn_urls": [
        "https://cdnjs.cloudflare.com/ajax/libs/Chart.js/4.4.3/chart.umd.min.js",
        "https://cdn.jsdelivr.net/npm/chart.js@4.4.3/dist/chart.umd.min.js"
      ]
    }
  ],
  "model_fidelity": "semi-quantitative",
  "validation_results": {
    "js_syntax": "pass: extracted inline JS to /tmp/lab-anh-huong-nong-do-toc-do.inline.js and ran node --check",
    "risky_globals": "pass: rg found no var GK, function gk, gkStart, gkLoadThree, or document.querySelector(\".",
    "cdn_version_pin": "pass: rg latest|next returned no matches; all CDN URLs include pinned versions.",
    "fallbacks": "pass: Three.js/WebGL fallback message exists; Chart.js falls back to custom canvas drawing.",
    "autoplay_or_demo": "pass: auto-run starts on load; pause, reset, concentration slider, time scrubber, slow/fast presets are present.",
    "layout": "pass: compact title, collapsible model note, main lab stage dominates; mobile overflow fixed after screenshot review.",
    "browser_smoke": "pass-with-warning: Chrome headless produced desktop screenshot at /tmp/lab-anh-huong-nong-do-toc-do-swift.png and fallback screenshot at /tmp/lab-anh-huong-nong-do-toc-do-desktop.png; environment did not expose WebGL.",
    "mobile_check": "pass: Chrome headless 390x844 screenshot /tmp/lab-anh-huong-nong-do-toc-do-mobile2.png showed no horizontal overflow."
  },
  "scores": {
    "chemistry_pedagogy": 19,
    "visual_dynamism": 14,
    "interaction_autoplay": 15,
    "lab_first_layout": 14,
    "technical_html": 14,
    "performance_mobile": 9,
    "learning_record": 10,
    "total": 95
  },
  "blockers": [],
  "warnings": [
    "Headless Chrome in this environment reported no WebGL, so the validated browser render exercised the designed fallback path rather than the Three.js scene.",
    "Mô hình tốc độ là bán định lượng; wording in UI states this limitation."
  ],
  "chemistry_review": "Phương trình và hiện tượng chính đúng mức SGK: sulfur keo/kết tủa làm đục dung dịch, dấu X biến mất nhanh hơn khi nồng độ thiosulfate cao hơn.",
  "browser_checks": "Chrome headless opened the local file and wrote screenshots; DBus/GPU warnings were environment-level and did not stop page render.",
  "mobile_checks": "390x844 layout stacks title, stage, controls, and chart; horizontal overflow was fixed with scoped min-width and overflow rules.",
  "improvement_plan": [
    "Nếu cần xác nhận Three.js visual đầy đủ, mở trong browser desktop có WebGL thật thay vì headless môi trường này."
  ],
  "changes_applied": [
    "Regenerated self-contained scoped HTML with compact lab-first layout.",
    "Added auto-run, pause, reset, concentration/time manual controls, fallback UI, and pinned CDN loaders."
  ],
  "final_status": "pass-with-warnings",
  "created_at": "2026-06-19T10:36:08Z",
  "tool_model": "GPT-5 Codex"
}
