{
  "slug": "lab-dien-phan-cuso4-dien-cuc-than-chi",
  "output_file": "skills_material_K12/skills/chemistry-experiment-lab/outputs/lab-dien-phan-cuso4-dien-cuc-than-chi.html",
  "prompt": "Refactor the electrolysis lesson to match the user's preferred educational layout style from the older sample HTML files.",
  "experiment": {
    "title": "Điện phân dung dịch CuSO4 với điện cực than chì",
    "grade": "Hóa 12",
    "learning_goal": "Xác định sản phẩm ở catot và anot khi điện phân dung dịch CuSO4 với điện cực trơ, đồng thời liên hệ hiện tượng với biến thiên theo thời gian.",
    "learning_loop": {
      "predict": "Dự đoán sản phẩm tạo thành ở catot và anot.",
      "observe": "Quan sát lớp đồng bám, bọt khí O2 và màu dung dịch Cu2+ nhạt dần.",
      "compare": "So sánh hiện tượng thật với lựa chọn ban đầu và với sơ đồ điện cực.",
      "explain": "Giải thích vì sao Cu2+ bị khử ở catot còn nước bị oxi hóa ở anot trơ."
    },
    "reaction": "Catot: Cu2+ + 2e -> Cu; Anot: 2H2O -> O2 + 4H+ + 4e",
    "notes": "Bản refactor chuyển từ dark cinematic sang light lab-panel: scene chính đi kèm card dự đoán/điều khiển, schematic điện cực và chart/process riêng."
  },
  "interaction_pattern": "electrolysis-electrode-products-with-chart",
  "libraries": [
    {
      "name": "Three.js",
      "version": "0.160.0",
      "role": "render",
      "rationale": "render becher, điện cực, lớp đồng, bọt khí và trạng thái dung dịch như hiện tượng chính",
      "cdn_urls": [
        "https://cdn.jsdelivr.net/npm/three@0.160.0/build/three.min.js",
        "https://unpkg.com/three@0.160.0/build/three.min.js"
      ]
    },
    {
      "name": "GSAP",
      "version": "3.12.5",
      "role": "timeline",
      "rationale": "điều phối autoplay, pause/resume/reset và các mốc diễn tiến của thí nghiệm",
      "cdn_urls": [
        "https://cdnjs.cloudflare.com/ajax/libs/gsap/3.12.5/gsap.min.js",
        "https://cdn.jsdelivr.net/npm/gsap@3.12.5/dist/gsap.min.js"
      ]
    },
    {
      "name": "Chart.js",
      "version": "4.4.3",
      "role": "chart",
      "rationale": "thể hiện rõ tiến trình đồng bám, O2 thoát ra và độ đậm màu Cu2+ còn lại theo thời gian",
      "cdn_urls": [
        "https://cdnjs.cloudflare.com/ajax/libs/Chart.js/4.4.3/chart.umd.min.js",
        "https://cdn.jsdelivr.net/npm/chart.js@4.4.3/dist/chart.umd.min.js"
      ]
    }
  ],
  "model_fidelity": "semi-quantitative",
  "validation_results": {
    "js_syntax": "pass: inline script extracted and checked with node --check",
    "risky_globals": "pass: no matches for GK/gkStart/gkLoadThree/unscoped document.querySelector/latest/next in output",
    "cdn_version_pin": "pass: all library URLs are version pinned",
    "fallbacks": "pass: load failures are routed to visible fallback messages",
    "autoplay_or_demo": "pass: autoplay controls plus quick-jump actions for middle and final states",
    "layout": "pass: light lab/instrument panel layout with clear scene, control, schematic and chart/process blocks",
    "browser_smoke": "pass: verify-widget.sh produced desktop/mobile screenshots and trace artifacts",
    "mobile_check": "pass: mobile screenshot shows no horizontal overflow and primary controls remain visible"
  },
  "scores": {
    "chemistry_pedagogy": 20,
    "visual_dynamism": 15,
    "interaction_autoplay": 15,
    "lab_first_layout": 15,
    "technical_html": 15,
    "performance_mobile": 9,
    "learning_record": 10,
    "total": 99
  },
  "blockers": [],
  "warnings": [],
  "chemistry_review": "Nội dung bám SGK: catot bám Cu, anot giải phóng O2 với điện cực than chì; chart và schematic chỉ đóng vai trò giải thích, không overclaim số liệu thực nghiệm tuyệt đối.",
  "browser_checks": "Playwright-based verifier passed on desktop and mobile. WebGL ran through SwiftShader fallback in headless Chromium.",
  "mobile_checks": "Mobile verification passed with no overflow and visible primary controls.",
  "design_family": "electrolysis",
  "design_fingerprint": "three-gsap-chart-light-lab-panel-scene-plus-schematic-predict-observe-compare-explain",
  "promoted_as_baseline": false,
  "verification": {
    "environment": {
      "browser": "chromium",
      "headless": true,
      "os": "linux",
      "viewport": "desktop-1280x800 + mobile-iPhone13"
    },
    "webgl": {
      "supported": true,
      "renderer_type": "ANGLE (Google, Vulkan 1.3.0 (SwiftShader Device (Subzero) (0x0000C0DE)), SwiftShader driver)",
      "fallback_used": true
    },
    "invariants": {
      "stage_present": true,
      "stage_dominance_pass": true,
      "autoplay_or_primary_run_pass": true,
      "mobile_fit_pass": true,
      "fallback_present": false
    }
  },
  "artifacts": {
    "desktop_screenshot": "/home/ding/debug_mc/material_creator/skills_material_K12/skills/chemistry-experiment-lab/evaluations/artifacts/lab-dien-phan-cuso4-dien-cuc-than-chi/2026-06-19T19-53-39Z/desktop.png",
    "mobile_screenshot": "/home/ding/debug_mc/material_creator/skills_material_K12/skills/chemistry-experiment-lab/evaluations/artifacts/lab-dien-phan-cuso4-dien-cuc-than-chi/2026-06-19T19-53-39Z/mobile.png",
    "trace": "/home/ding/debug_mc/material_creator/skills_material_K12/skills/chemistry-experiment-lab/evaluations/artifacts/lab-dien-phan-cuso4-dien-cuc-than-chi/2026-06-19T19-53-39Z"
  },
  "improvement_plan": [
    "If this style is adopted as default, encode the explicit requirement for chart/schematic blocks directly into the skill's electrolysis family guidance.",
    "Check screenshots on a real GPU browser before promoting this version as a visual baseline."
  ],
  "changes_applied": [
    "Refactored the electrolysis lesson from dark cinematic to a light lab/instrument panel layout.",
    "Added separate schematic and chart/process cards to match the user's preferred educational structure.",
    "Reduced heavy overlays on the scene and kept only compact live readouts.",
    "Verified with the Playwright-based verifier and recorded new desktop/mobile artifacts."
  ],
  "final_status": "pass",
  "created_at": "2026-06-19T19:53:39Z",
  "tool_model": "gpt-5 codex"
}
