{
  "slug": "pin-daniel-fixture",
  "output_file": "runs/2026-06-20T12-50-00Z-pin-daniel-fixture/attempts/attempt_0/widget.html",
  "experiment": {
    "title": "Pin điện hóa Zn-Cu",
    "grade": "Hóa 12",
    "learning_goal": "Dự đoán và giải thích hướng electron cùng sự thay đổi ở hai điện cực."
  },
  "interaction_pattern": "stage-plus-side-panel",
  "libraries": [],
  "model_fidelity": "qualitative",
  "validation_results": {
    "html_self_contained": "pass",
    "learning_loop": "pass"
  },
  "scores": {
    "total": 90
  },
  "blockers": [],
  "warnings": [],
  "design_family": "electrolysis",
  "verification": {
    "invariants": {
      "stage_present": true,
      "mobile_fit_pass": true
    }
  },
  "artifacts": {
    "desktop_screenshot": "artifacts/desktop.png",
    "mobile_screenshot": "artifacts/mobile.png",
    "trace": "artifacts/trace.zip"
  },
  "promoted_as_baseline": false,
  "final_status": "pass",
  "created_at": "2026-06-20T12:50:03Z"
}
